name,url,source,remote,city,short_description,prizes,sponsors,judges,start_date,end_date,registration_deadline,themes,scraping_method,format
World’s Largest Hackathon presented by Bolt,https://worldslargesthackathon.devpost.com/?ref_feature=challenge&ref_medium=discover,devpost,True,,Build with AI for a shot at some of the $1M+ in prizes.,"['$125,000 Grand Prize', '$100,000 Second Place', '$75,000 Third Place', '$50,000 Fourth Place', '$47,500 Fifth Place', '$45,000 Sixth Place', '$42,500 Seventh Place', '$40,000 Eighth Place', '$37,500 Ninth Place', '$35,000 Tenth Place']","['Entri', 'Netlify', 'RevenueCat', 'Supabase', 'Algorand Foundation', 'AWS', 'ElevenLabs', 'Espresso', 'GV', 'Reddit']",,,,2025-06-30,"['Beginner Friendly', 'Low/No Code', 'Machine Learning/AI']",firecrawl,
Agent Development Kit Hackathon with Google Cloud,https://googlecloudmultiagents.devpost.com/?ref_feature=challenge&ref_medium=discover,devpost,True,,Build multi-agent AI systems with Agent Development Kit and Google Cloud.,"['$15,000 Grand Prize', '$1,000 Honorable Mentions', '$8,000 North America Regional Winner', '$8,000 Latin America Regional Winner', '$8,000 Asia Pacific Regional Winner', '$8,000 Europe, Middle East, Africa Regional Winner']",['Google'],"[{'name': 'Erwin Huizenga', 'company': 'Google', 'title': 'AI/ML DevRel'}, {'name': 'Anton Popovine', 'company': 'Google', 'title': 'Customer Engineer, Digital Natives'}, {'name': 'Alejandro Montenegro', 'company': 'Google', 'title': 'Field Solutions Architect, Generative AI'}, {'name': 'Riccardo Carlesso', 'company': 'Google', 'title': 'Developer Advocate • Engineering'}, {'name': 'Elise Landman', 'company': 'Google', 'title': 'AI/ML Customer Engineer'}]",,,2025-06-23,"['Machine Learning/AI', 'Low/No Code', 'Open Ended']",firecrawl,
AI in Action,https://ai-in-action.devpost.com/?ref_feature=challenge&ref_medium=discover,devpost,True,,"Join us for an electrifying hackathon where you'll harness the game-changing power of Google Cloud, focusing on AI and machine learning.","['$12,500 in cash for MongoDB Track First Place', '$12,500 in cash for GitLab Track First Place', '$7,500 in cash for MongoDB Track Second Place', '$7,500 in cash for GitLab Track Second Place', '$5,000 in cash for MongoDB Track Third Place', '$5,000 in cash for GitLab Track Third Place']","['MongoDB', 'GitLab']","[{'name': 'Shane McAllister', 'company': 'MongoDB', 'title': 'Lead Developer Relations'}, {'name': 'Nick Veenhof', 'company': 'GitLab', 'title': 'Director, Contributor Success and Programs'}, {'name': 'Stanimira Vlaeva', 'company': 'MongoDB', 'title': 'Sr. Developer Advocate'}, {'name': 'Regnard Raquedan', 'company': 'GitLab', 'title': 'Senior Ecosystem Solutions Architect'}, {'name': 'Delphin Barankanira', 'company': 'Google', 'title': 'Cloud Partner Engineering Lead'}, {'name': 'Rajesh Agadi', 'company': 'Google', 'title': 'Principal Architect'}, {'name': 'Siddharth Desai', 'company': 'Google', 'title': 'Partner Engineer - AI/ML'}, {'name': 'Saurabh Kumar', 'company': 'Google', 'title': 'ISV Partner Engineer'}]",,,2025-06-17,"['Databases', 'Machine Learning/AI', 'Open Ended']",firecrawl,
AWS Presents: Breaking Barriers Virtual Challenge,https://aws-breaking-barriers.devpost.com/?ref_feature=challenge&ref_medium=discover,devpost,True,,Join us for an innovative worldwide virtual challenge designed to accelerate the development of AI solutions promoting digital inclusion.,"['$9,000 in cash for 1st Prize', '$5,000 in cash for 2nd Prize', '$2,000 in cash for 3rd Prize', '$25 in AWS promotional credits for Optional Skills Challenge Participation']","['NVIDIA', 'Anthropic', 'AT&T', 'Tech Mahindra', 'Deutsche Telekom', 'Rogers', 'Safaricom', 'Fastweb']","[{'name': 'Kaniz Mahdi', 'company': 'AWS', 'title': 'Director of Technology'}, {'name': 'Mark Austin', 'company': 'AT&T', 'title': 'VP, Data Science'}, {'name': 'Fred Devoir', 'company': 'NVIDIA', 'title': 'Global Head of Solution Architecture and Engineering - Telco'}, {'name': 'Julian Williams', 'company': 'Anthropic', 'title': 'Telecommunications Industry Lead'}, {'name': 'Neel Dayal', 'company': 'Rogers', 'title': 'Head of Innovation and Partnerships'}, {'name': 'Ahmed Hafez', 'company': 'Deutsche Telekom', 'title': 'VP Technology Strategy'}, {'name': 'Giovanni Germani', 'company': 'Fastweb', 'title': 'Manager of Architecture & Artificial Intelligence'}, {'name': 'Charlotte Kepadisa', 'company': 'Safaricom', 'title': 'Head of Big Data & AI'}, {'name': 'Rohit Rajput', 'company': 'Tech Mahindra', 'title': 'Group Practice Head - Automation, AI and OSS'}, {'name': 'Robert Belson', 'company': 'AWS', 'title': 'Senior Developer Advocate'}]",,,2025-06-23,"['Machine Learning/AI', 'Social Good', 'Communication']",firecrawl,
HP & NVIDIA Developer Challenge,https://hpaistudio.devpost.com/?ref_feature=challenge&ref_medium=discover,devpost,True,,"Transform Industries Through AI - Build, Innovate, Deploy with HP AI Studio and NVIDIA.","['$70,000 in cash']","['HP', 'NVIDIA']",[],,2025-06-09,2025-06-09,"['Machine Learning/AI', 'Open Ended']",firecrawl,
Adobe Express Add-ons Hackathon,https://adobeexpress.devpost.com/?ref_feature=challenge&ref_medium=discover,devpost,True,,"An exciting opportunity for developers, designers, and creative builders to bring their idea to life and shape the future of Adobe Express.","['$30,000 in prizes', '$5,000 Most valuable to Express users', '$5,000 Best AI-enhanced experience', '$5,000 Best integration or workflow hack', '$5,000 Best new video innovation', '$5,000 Collaboration Catalyst', ""$5,000 'Express Yourself' wildcard""]",['Adobe'],"[{'name': 'Taylor Krusen', 'company': 'Adobe', 'title': 'Sr Developer Advocate'}, {'name': 'Ruben Rincon giraldo', 'company': 'Adobe', 'title': 'Group Product Manager'}, {'name': 'Steph Corrales', 'company': 'Adobe', 'title': 'Sr Experience Designer'}, {'name': 'Holly Schinsky', 'company': 'Adobe', 'title': 'Sr DevRel Engineer'}, {'name': 'Alex Castanheira', 'company': 'Adobe', 'title': 'Platform Partnership'}, {'name': 'Gloria Wang', 'company': 'Adobe', 'title': 'Sr Software Engineer'}, {'name': 'Tate Masi', 'company': 'Adobe', 'title': 'Sr Product Manager'}]",,,2025-07-15,"['Design', 'Machine Learning/AI', 'Web']",firecrawl,
